control_id,standard,control_name,status,owner_role,evidence_paths,tracked_issue,notes
SSDF-PO.1,NIST SSDF 1.1,Release role sign-off workflow,implemented,"Security Lead;Release Lead","docs/security/STANDARDS_PROFILE.md;docs/release-integrity.md",,"Release sign-off and fallback delegate policy documented."
SSDF-PW.4,NIST SSDF 1.1,Security-relevant PR checklist and control-matrix maintenance,implemented,Security Lead,".github/PULL_REQUEST_TEMPLATE.md;.github/workflows/pr-policy.yml;docs/security/STANDARDS_PROFILE.md",,"Security-relevant PRs must complete the checklist."
SLSA-BUILD.2,SLSA 1.2,Build isolation and provenance policy,implemented,Release Lead,"docs/release-integrity.md;scripts/release-build-core.sh;scripts/verify-reproducible-build.sh;scripts/verify-release-integrity.sh",,"Release blockers and provenance requirements are documented."
ASVS-V2,OWASP ASVS 5.0,Auth and access-control negative-path coverage,partial,Relay Lead,"relay-node/src/;docs/security-runbook.md",38,"Broaden admin/scoped credential misuse coverage and map evidence explicitly."
ASVS-V5,OWASP ASVS 5.0,Replay and malformed-input negative-path coverage,partial,Relay Lead,"relay-node/src/;directory-dht/src/;docs/security-runbook.md",39,"Expand replay/input coverage and bind detector IDs to runbook actions."
MASVS-RESILIENCE,OWASP MASVS 2.1,Mobile runtime compromise resilience evidence,partial,Mobile Lead,"docs/security/AUTO_PROCESSING_LOCKDOWN.md;docs/security/LOCKDOWN_COMPATIBILITY_MATRIX.md;RedoorApp/",40,"Add explicit evidence for strict posture and compromise-sensitive behavior."
KEY-HSM,Internal roadmap / SSDF alignment,Managed or hardware-backed signing and rotation,partial,Platform Lead,"scripts/lib/key-provider.sh;scripts/rotate-directory-signing-key.sh;scripts/rotate-relay-hmac.sh;docs/security-runbook.md",15,"Provider-backed hooks exist; managed production custody and audit coverage remain open."
